Kandavas novads,Tukuma apriņķis,C,Kandavas novada Zantes kultūras nama jauniešu deju kolektīvs,Marita Jekuma,"37,5",II pakāpe,"37,5",0
Liepājas pilsēta,Liepājas apriņķis,C,Liepājas Bērnu un jaunatnes centra jauniešu deju kolektīvs “Vaduguns”   ,Eva Krētaine,"37,5",II pakāpe,"37,5",0
Madonas novads,Madonas apriņķis,C,Madonas novada Praulienas pagasta Saikavas tautas nama jauniešu deju kolektīvs,Daiga Maderniece,"37,5",II pakāpe,"37,5",0
Krāslavas novads,Krāslavas apriņķis,C,Krāslavas pilsētas Valsts ģimnāzijas jauniešu deju kolektīvs “Jumis”,Ingrīda Grišāne,"37,3",II pakāpe,"37,3",0
Madonas novads,Madonas apriņķis,C,Madonas novada Sarkaņu pagasta tautas nama “Kalnagravas” jauniešu deju kolektīvs “Resgaļi”   ,Inga Pujate,"37,3",II pakāpe,"37,3",0
Saulkrastu novads,Siguldas apriņķis,C,"Saulkrastu novada Saulkrastu vidusskolas Jauniešu deju kolektīvs ""Saulīte""",Jānis Trezuns,"37,2",II pakāpe,"37,2",0
Aizputes novads,Liepājas apriņķis,C,Aizputes vidusskolas jauniešu deju kolektīvs “Vārpa”   ,Inta Rudzīte,"37,0",II pakāpe,"37,0",0
Jelgavas novads,Jelgavas apriņķis,C,"Jelgavas novada Sesavas pagasta tautas nama Jauniešu deju kolektīvs ""Pāris""",Līga Lapšina,"37,0",II pakāpe,"37,0",0
Jelgavas pilsēta,Jelgavas pilsēta,C,"Jelgavas pilsētas pašvaldības iestādes ""Kultūra"" Jauniešu deju kolektīvs ""Zemgaļi""",Daina Kjakste,"37,0",II pakāpe,"37,0",0
Brocēnu novads,Saldus apriņķis,C,Brocēnu novada Blīdenes kultūras nama jauniešu deju kolektīvs  “Blīdene”   ,Sanita Šampiņa-Bergmane,"36,8",II pakāpe,"36,8",0
Carnikavas novads,Siguldas apriņķis,C,"Carnikavas novada Carnikavas tautas nama ""Ozolaine"" Jauniešu deju kolektīvs ""Abi divi"" studija",Anita un Jānis Precinieki,"36,7",II pakāpe,"36,7",0
Bauskas novads,Bauskas apriņķis,C,"Bauskas novada Codes pagasta Jauniešu deju kolektīvs ""Code""",Gunta Sirmele,"36,3",II pakāpe,"36,3",0
Gulbenes novads,Gulbenes apriņķis,C,"Tirzas Kultūras nama Jauniešu deju kolektīvs ""Tirza""",Iveta Eiduka,"36,3",II pakāpe,"36,3",0
Jūrmalas pilsēta,Tukuma apriņķis,C,Jūrmalas pilsētas Jūrmalas Valsts ģimnāzijas jauniešu deju kolektīvs,Žanna Kļava,"36,3",II pakāpe,"36,3",0
Ārzemes,Ārzemes,C,"Jauniešu deju kolektīvs ""Salinieki"" (Londona, Anglija)",Kaspars Fridmanis,"36,2",II pakāpe,"36,2",0
Ropažu novads,Siguldas apriņķis,C,"Ropažu novada kultūras un izglītības centra Jauniešu deju kolektīvs ""Cielaviņa""",Terēza Jozefa,"36,2",II pakāpe,"36,2",0
Alūksnes novads,Alūksnes apriņķis,C,Pededzes Tautas nama Jauniešu deju kolektīvs,Ludmila Uglovska,"36,0",II pakāpe,"36,0",0
Cesvaines novads,Madonas apriņķis,C,Cesvaines novada Cesvaines kultūras nama jauniešu deju kolektīvs “Cesvaine” studija  ,Jānis Šķēle,"36,0",II pakāpe,"36,0",0
Rēzeknes novads,Rēzeknes apriņķis,C,Rēzeknes novada Lendžu pagasta kultūras nama jauniešu deju kolektīvs “Ūdzeņa” ,Sintija Gailuma,"36,0",II pakāpe,"36,0",0
Skrundas novads,Kuldīgas apriņķis,C,Skrundas novada Skrundas kultūras nama jauniešu deju kolektīvs “Tikai tā”    ,Dita Ņuņēvica,"36,0",II pakāpe,"36,0",0
Rēzeknes novads,Rēzeknes apriņķis,C,Rēzeknes novada Nautrēnu pagasta pārvaldes jauniešu deju kolektīvs “Troks voi!”  ,Ingūna Ludborža,"35,8",II pakāpe,"35,8",0
Aglonas novads,Preiļu apriņķis,C,Aglonas novada Aglonas vidusskolas jauniešu deju kolektīvs,Dina Staškeviča,"35,7",II pakāpe,"35,7",0
Jelgavas pilsēta,Jelgavas pilsēta,C,Jelgavas Tehnikuma deju kolektīvs,Sanita Laganovska,"35,7",II pakāpe,"35,7",0
Ārzemes,Ārzemes,C,"Jauniešu deju kolektīvs ""Danči"" (Minstere, Vācija)",Inga Pētersone,"35,0",II pakāpe,35,0
Tukuma novads,Tukuma apriņķis,C,Tukuma novada Pūres kultūras nama jauniešu deju kolektīvs „Pūrenieks”,Inese Cīrule,"35,0",II pakāpe,"35,0",0
Jelgavas pilsēta,Jelgavas pilsēta,C,Jelgavas Spīdolas ģimnāzijas Jauniešu deju kolektīvs,Jānis Sālzirnis,"34,5",III pakāpe,"34,5",0
Kocēnu novads,Valmieras apriņķis,C,"Kocēnu novada Bērzaines tautas nama Jauniešu deju kolektīvs ""Akcents""",Sarmīte Freimane,"33,8",III pakāpe,"33,8",0
Mazsalacas novads,Valmieras apriņķis,C,"Mazsalacas novada Kultūras centra jauniešu deju kolektīvs ""Oga""",Aija Vidovska,"33,8",III pakāpe,"33,8",0
Kuldīgas novads,Kuldīgas apriņķis,C,Kuldīgas Mākslas un humanitāro zinību vidusskolas jauniešu deju kolektīvs “Austra”  ,Zane Kalniņa,"33,7",III pakāpe,"33,7",0
Saldus novads,Saldus apriņķis,C,"Saldus novada Pašvaldības aģentūras “Saldus Tūrisma informācijas, kultūras un sporta centrs” Tautas deju ansambļa “Kursa” studija  ",Inese Buša,"33,5",III pakāpe,"33,5",0
Daugavpils novads,Daugavpils apriņķis,C,Daugavpils novada Vaboles pagasta  Vaboles kultūras nama jauniešu deju kolektīvs “Aisma”,Anita Šalkovska,"33,3",III pakāpe,"33,3",0
Tērvetes novads,Dobeles apriņķis,C,"Tērvetes novada Augstkalnes vidusskolas Jauniešu deju kolektīvs ""Savējie""",Rudīte Dude,"33,0",III pakāpe,"33,0",0
Ārzemes,Ārzemes,C,"Jauniešu deju kolektīvs ""Daugaviņa"" (Kanāda)",Selga Apse,"32,5",III pakāpe,"32,5",0
Kārsavas novads,Ludzas apriņķis,C,Kārsavas novada Salnavas pagasta Salnavas kultūras nama jauniešu deju kolektīvs “Salnaviņa”  ,Solvita Dzērkale,"32,5",III pakāpe,"32,5",0
Ogres novads,Ogres apriņķis,C,Ogres novada Profesionālās izglītības kompetences centra “ Ogres tehnikums” jauniešu deju kolektīvs “Solis”,Daira Dāle,"32,3",III pakāpe,"32,3",0
Rēzeknes pilsēta,Rēzeknes apriņķis,C,Rēzeknes pilsētas tehnikuma jauniešu deju kolektīvs “Oira”  ,Gunta Sidorova,"32,3",III pakāpe,"32,3",0
Rēzeknes novads,Rēzeknes apriņķis,C,Rēzeknes novada Nagļu pagasta tautas nama jauniešu deju kolektīvs “Pipareņš” ,Laura Ābola,"32,2",III pakāpe,"32,2",0
Zilupes novads,Ludzas apriņķis,C,Zilupes novada Zilupes tautas nama jauniešu deju kolektīvs “Tracis”    ,Snežana Veikšāne,"31,2",III pakāpe,"31,2",0
Ventspils pilsēta,Ventspils apriņķis,C,Ventspils pilsētas domes Kultūras centra Ventspils Augstskolas jauniešu deju kolektīvs “Strautuguns”    ,Ineta Judzika,"30,3",III pakāpe,"30,3",0
Alūksnes novads,Alūksnes apriņķis,C,Liepnas vidusskolas Jauniešu deju kolektīvs,Ināra Orbidāne,"29,8",Diploms par piedalīšanos,"29,8",0
Madonas novads,Madonas apriņķis,C,Madonas novada Bērzaunes pagasta Sauleskalna tautas nama jauniešu deju kolektīvs  ,Inga Pujate,"29,8",Diploms par piedalīšanos,"29,8",0
Madonas novads,Madonas apriņķis,C,Madonas novada Mētrienas pagasta Mētrienas tautas nama jauniešu deju kolektīvs “Meteņi”,Anna Anita Amata,"29,8",Diploms par piedalīšanos,"29,8",0
Vecumnieku novads,Bauskas apriņķis,C,"Bārbeles tautas nama Jauniešu deju kolektīvs ""Rakari""",Agita Seglicka,"29,5",Diploms par piedalīšanos,"29,5",0
Ludzas novads,Ludzas apriņķis,C,Ludzas novada Ludzas Bērnu un jauniešu centra jauniešu deju kolektīvs “Žiks”,Elita Romanovska un Inese Mikaskina,"28,8",Diploms par piedalīšanos,"28,8",0
Tukuma novads,Tukuma apriņķis,C,Tukuma novada Tukuma 2.pamatskolas jauniešu deju kolektīvs „Mare”,Juris Poga,"28,8",Diploms par piedalīšanos,"28,8",0
Pārgaujas novads,Cēsu apriņķis,C,"Pārgaujas novada Straupes pagasta tautas nama jauniešu deju kolektīvs ""Idumeja""",Ginta Berķe,"28,7",Diploms par piedalīšanos,"28,7",0
Daugavpils novads,Daugavpils apriņķis,C,Daugavpils novada Maļinovas pagasta saieta nama jauniešu deju kolektīvs “Druvāni” ,Antra Dombrovska,"28,5",Diploms par piedalīšanos,"28,5",0
Jēkabpils novads,Jēkabpils apriņķis,C,Jēkabpils novada Rubenes pagasta Rubenes kultūras nama jauniešu deju kolektīvs “Laude”   ,Sandra Vaitķeviča,"28,2",Diploms par piedalīšanos,"28,2",0
Talsu novads,Talsu apriņķis,C,Talsu novada Valdgales kultūras nama jauniešu deju kolektīvs “Latiņš”   ,Daina Miķelsone,"27,8",Diploms par piedalīšanos,"27,8",0
Aknīstes novads,Jēkabpils apriņķis,C,Aknīstes novada Aknīstes vidusskolas jauniešu deju kolektīvs   ,Aivars Ielejs,"27,0",Diploms par piedalīšanos,"27,0",0
Kārsavas novads,Ludzas apriņķis,C,Kārsavas novada Salnavas pagasta Salnavas kultūras nama jauniešu deju kolektīvs “Vaļasprieki”    ,Valentīna Kirsanova,"26,3",Diploms par piedalīšanos,"26,3",0
Ārzemes,Ārzemes,C,"Jauniešu deju kolektīvs ""Rakstā"" (Peterboro, Anglija)",Inese Asermane,"25,7",Diploms par piedalīšanos,"25,7",0
Saldus novads,Saldus apriņķis,C,Saldus novada Nīgrandes pagasta Kalnu kultūras nama jauniešu deju kolektīvs “Jumis”   ,Ligita Ķiene,"24,8",Diploms par piedalīšanos,"24,8",0
Kārsavas novads,Ludzas apriņķis,C,Kārsavas novada Mērdzenes pagasta Mērdzenes kultūras nama jauniešu deju kolektīvs “Dancari” ,Anita Šarkovska,"24,3",Diploms par piedalīšanos,"24,3",0
Ludzas novads,Ludzas apriņķis,C,Ludzas novada Ludzas pilsētas ģimnāzijas jauniešu deju kolektīvs  “Žiks” ,Elita Romanovska,"23,8",Diploms par piedalīšanos,"23,8",0
Ārzemes,Ārzemes,C,"Austrālijas jauniešu deju kolektīvs ""Jūrmalnieki""",Lāra Brennere,"23,7",Diploms par piedalīšanos,"23,7",0
Ludzas novads,Ludzas apriņķis,C,Ludzas novada Ludzas Bērnu un jauniešu centra jauniešu deju kolektīvs “Žeperi”   ,Sarmīte Stapule,"23,7",Diploms par piedalīšanos,"23,7",0
Aizkraukles novads,Aizkraukles apriņķis,C,"Aizkraukles novada kultūras nama Aizkraukles pagasta Jauniešu deju kolektīvs ""Zeļļi""",Una Stakle,"23,5",Diploms par piedalīšanos,"23,5",0
Saldus novads,Saldus apriņķis,C,Saldus novada Zirņu pagasta pārvaldes jauniešu deju kolektīvs “Virpulis”   ,Dita Ņuņēvica,"23,0",Diploms par piedalīšanos,"23,0",0
Rēzeknes pilsēta,Rēzeknes apriņķis,C,Rēzeknes pilsētas Valsts 1.ģimnāzijas jauniešu deju kolektīvs “Skali”  ,Sandra Juste,"22,5",Diploms par piedalīšanos,"22,5",0
Kuldīgas novads,Kuldīgas apriņķis,D,Kuldīgas novada Pašvaldības aģentūras  “Kuldīgas kultūras centrs” vidējās paaudzes deju kopa “Bandava” ,Ramona Irbe,"59,5",Augstākā pakāpe,"49,5",10
Rīgas pilsēta,Rīgas pilsēta,D/D1,Latvijas Universitātes biedrības „Juventus” vidējās paaudzes deju kolektīvs „Dancis”,Rolands Juraševskis,"59,5",Augstākā pakāpe,"49,5",10
Rīgas pilsēta,Rīgas pilsēta,D/D1,Rīgas kultūras un tautas mākslas centra „Mazā Ģilde” vidējās paaudzes deju kolektīvs „Līgo”,Jānis Purviņš,"59,0",Augstākā pakāpe,"49,0",10
Rīgas pilsēta,Rīgas pilsēta,D,Rīgas kultūras un tautas mākslas centra  „Mazā Ģilde” deju ansamblis „Daiļrade”,Iveta Pētersone-Lazadāne,"58,7",Augstākā pakāpe,"48,7",10
Ogres novads,Ogres apriņķis,D,Ogres novada Kultūras centra vidējās paaudzes deju kolektīvs “Raksti”   ,Edgars Tabors,"58,2",Augstākā pakāpe,"48,2",10
Lielvārdes novads,Ogres apriņķis,D,Lielvārdes novada Kultūras centra struktūrvienības kultūras nama “Lielvārde” vidējās paaudzes deju kolektīvs “Vēji”   ,Iluta Mistre,"58,0",Augstākā pakāpe,"48,0",10
Rīgas pilsēta,Rīgas pilsēta,D,Rīgas Tehniskās universitātes Tautas deju ansambļa „Vektors” vidējā paaudze,Uldis Šteins,"58,0",Augstākā pakāpe,"48,0",10
Valmieras pilsēta,Valmieras apriņķis,D,"Valmieras Kultūras centra Vidējās paaudzes deju kolektīvs ""Gauja""",Artis Mellups,"58,0",Augstākā pakāpe,"48,0",10
Balvu novads,Balvu apriņķis,D,"Balvu Kultūras un atpūtas centra deju kopa ""Nebēda""",Agris Veismanis,"57,7",Augstākā pakāpe,"47,7",10
Līgatnes novads,Cēsu apriņķis,D,"Līgatnes novada pašvaldības aģentūras ""Kultūras un tūrisma centrs"" Vidējās paaudzes deju kolektīvs ""Zeperi""",Liene Frīdberga,"57,5",Augstākā pakāpe,"47,5",10
Mārupes novads,Pierīgas apriņķis,D/D1,"Mārupes novada domes kultūras nama Vidējās paaudzes deju kolektīvs ""Mārupieši""",Gunta Skuja,"57,5",Augstākā pakāpe,"47,5",10
Bauskas novads,Bauskas apriņķis,D,"Bauskas novada, Īslīces pagasta Vidējās paaudzes deju kolektīvs ""Līdums""",Arvils Noviks,"57,3",Augstākā pakāpe,"47,3",10
Rīgas pilsēta,Rīgas pilsēta,D/D1,VEF Kultūras pils vidējās paaudzes deju kolektīvs „Mana Rotaļa”,Dace Adviljone,"57,3",Augstākā pakāpe,"47,3",10
Rīgas pilsēta,Rīgas pilsēta,D/D1,"Rīgas pašvaldības Kultūras iestāžu apvienības Koncertorganizācijas ,,Ave Sol” Tautas deju ansamblis „Teiksma”",Jānis  Ērglis,"57,2",Augstākā pakāpe,"47,2",10
Rīgas pilsēta,Rīgas pilsēta,D/D1,VEF Kultūras pils vidējās paaudzes deju kolektīvs „Rotaļa XO”,Gints Baumanis,"57,2",Augstākā pakāpe,"47,2",10
Smiltenes novads,Smiltenes apriņķis,D/D1,"Smiltenes pilsētas Kultūras centra Vidējās paaudzes deju kolektīvs ""Ieviņa""",Reinis Rešetins,"57,2",Augstākā pakāpe,"47,2",10
Talsu novads,Talsu apriņķis,D/D1,"Talsu tautas nama vidējās paaudzes deju kolektīvs ""Talsu Kurši""",Lita Freimane,"57,2",Augstākā pakāpe,"47,2",10
Jelgavas pilsēta,Jelgavas pilsēta,D,"Jelgavas pilsētas pašvaldības iestādes ""Kultūra"" Tautas deju ansamblis ""Lielupe""",Elita Simsone,"56,8",Augstākā pakāpe,"46,8",10
Rīgas pilsēta,Rīgas pilsēta,D/D1,Rīgas kultūras un tautas mākslas centra „Mazā ģilde” vidējās paaudzes deju kolektīvs „Daiļrade”,Gunita Zirne,"56,8",Augstākā pakāpe,"46,8",10
Talsu novads,Talsu apriņķis,D/D1,Talsu novada Ģibuļu pagasta Pastendes kultūras nama vidējās paaudzes deju kolektīvs “Spriganis”   ,Iveta Kālberga,"56,8",Augstākā pakāpe,"46,8",10
Tukuma novads,Tukuma apriņķis,D/D1,Tukuma novada Tukuma pilsētas kultūras nama vidējās paaudzes deju kolektīvs „Vidums” ,Intars Kleinhofs,"56,8",Augstākā pakāpe,"46,8",10
Jēkabpils pilsēta,Jēkabpils apriņķis,D,Jēkabpils pilsētas tautas nama vidējās paaudzes deju kolektīvs “Sadancis” ,Inese Lazdāne,"56,7",Augstākā pakāpe,"46,7",10
Lubānas novads,Madonas apriņķis,D,"Lubānas novada Lubānas pilsētas kultūras nama Tautas deju ansamblis ""Lubāna"" ",Laila Ozoliņa,"56,5",Augstākā pakāpe,"46,5",10
Bauskas novads,Bauskas apriņķis,D,"Bauskas Kultūras centra Vidējās paaudzes deju kolektīvs ""Mēmele""",Ligita Irbīte,"56,3",Augstākā pakāpe,"46,3",10
Liepājas pilsēta,Liepājas apriņķis,D,Liepājas Universitātes vidējās paaudzes deju kolektīvs “Bandzenieki”   ,Kristīne Kārkliņa,"56,3",Augstākā pakāpe,"46,3",10
Ārzemes,Ārzemes,D,"Vidējās paaudzes deju kolektīvs ""Briseles latviešu dejotāji"" (Beļģija)",Dagnija Martinsone,"56,2",Augstākā pakāpe,"46,2",10
Tukuma novads,Tukuma apriņķis,D,Tukuma novada Tumes kultūras nama vidējās paaudzes deju kolektīvs  “Solis”,Gunta Krecere,"56,2",Augstākā pakāpe,"46,2",10
Rīgas pilsēta,Rīgas pilsēta,D,VEF Kultūras pils vidējās paaudzes deju kolektīvs „Zalktis”,Zane Behmane,"56,0",Augstākā pakāpe,"46,0",10
Alūksnes novads,Alūksnes apriņķis,D,"Alūksnes Kultūras centra deju kopa ""Olysta""",Agris Veismanis,"55,8",Augstākā pakāpe,"45,8",10
Jelgavas pilsēta,Jelgavas pilsēta,D,"Jelgavas pilsētas pašvaldības iestādes ""Kultūra"" Tautas deju ansamblis ""Ritums""",Ieva Karele,"55,8",Augstākā pakāpe,"45,8",10
Madonas novads,Madonas apriņķis,D,Madonas novada Madonas pilsētas kultūras nama Tautas deju ansamblis “Vidzeme”  ,Rudīte Jurciņa,"55,8",Augstākā pakāpe,"45,8",10
Valmieras pilsēta,Valmieras apriņķis,D,"Valmieras Kultūras centra Vidējās paaudzes deju kolektīvs ""Agrā Rūsa""",Baiba Ķirse,"55,8",Augstākā pakāpe,"45,8",10
Limbažu novads,Limbažu apriņķis,D/D1,"Limbažu Kultūras nama Vidējās paaudzes deju kolektīvs ""Jampadracis""",Andis Lēnmanis,"55,8",Augstākā pakāpe,"45,8",10
Garkalnes novads,Siguldas apriņķis,D,"Garkalnes novada domes kultūras centra ""Berģi"" Vidējās paaudzes deju kolektīvs ""Saime""",Viesturs Virza,"55,7",Augstākā pakāpe,"45,7",10
Rēzeknes pilsēta,Rēzeknes apriņķis,D,Rēzeknes pilsētas pašvaldības aģentūras “Rēzeknes Kultūras un tūrisma centrs” vidējās paaudzes deju kopa “Dziga”    ,Ilmārs Dreļs,"55,7",Augstākā pakāpe,"45,7",10
Rīgas pilsēta,Rīgas pilsēta,D,VEF Kultūras pils vidējās paaudzes deju kolektīvs „Gatve-otrā iespēja”,Gunta Raipala,"55,7",Augstākā pakāpe,"45,7",10
Salacgrīvas novads,Limbažu apriņķis,D,"Salacgrīvas Kultūras nama Vidējās paaudzes deju kolektīvs ""Tingeltangels""",Jānis Ērglis,"55,5",Augstākā pakāpe,"45,5",10
Grobiņas novads,Liepājas apriņķis,D/D1,Grobiņas novada Robežnieku kultūras centra vidējās paaudzes deju kolektīvs “Sudmaliņas”    ,Valda Grīnfelde,"55,5",Augstākā pakāpe,"45,5",10
Dobeles novads,Dobeles apriņķis,D,"Bikstu Kultūras un atpūtas centra Bikstu kultūras nama Vidējās paaudzes deju kolektīvs ""Bikstenieki""",Agita Jansone,"55,3",Augstākā pakāpe,"45,3",10
Preiļu novads,Preiļu apriņķis,D,Preiļu novada kultūras centra vidējās paaudzes deju kopa “ Talderi”  ,Silvija Kurtiņa,"55,3",Augstākā pakāpe,"45,3",10
Babītes novads,Pierīgas apriņķis,D,"Babītes novada pašvaldības Kultūrizglītības centra Vidējās paaudzes deju kolektīvs ""Dārta""",Lauris Siliņš,"55,2",Augstākā pakāpe,"45,2",10
Strenču novads,Smiltenes apriņķis,D,"Strenču novada Kultūras centra Vidējās paaudzes deju kolektīvs ""Tīne""",Ineta Lezdiņa,"55,2",Augstākā pakāpe,"45,2",10
Tukuma novads,Tukuma apriņķis,D,Tukuma novada Tukuma pilsētas kultūras nama vidējās paaudzes deju kolektīvs „Svīta”,Ilze Voiska,"55,2",Augstākā pakāpe,"45,2",10
Viesītes novads,Jēkabpils apriņķis,D,Viesītes novada Viesītes kultūras pils vidējās paaudzes deju kolektīvs “Augšzeme”  ,Andris Kivlenieks,"55,2",Augstākā pakāpe,"45,2",10
Daugavpils novads,Daugavpils apriņķis,D,Daugavpils novada kultūras centra “Vārpa” vidējās paaudzes deju kolektīvs “Līksme”  ,Aija Daugele,"55,0",Augstākā pakāpe,"45,0",10
Daugavpils pilsēta,Daugavpils apriņķis,D,Daugavpils pilsētas Latviešu kultūras centra vidējās paaudzes deju kolektīvs “Saime” ,Vilma Tāraude,"55,0",Augstākā pakāpe,"45,0",10
Saldus novads,Saldus apriņķis,D,"Saldus novada Pašvaldības aģentūras “Saldus Tūrisma informācijas, kultūras un sporta centrs” vidējās paaudzes deju kopa “Bandava”  ",Santa Laurinoviča,"55,0",Augstākā pakāpe,"45,0",10
Jēkabpils pilsēta,Jēkabpils apriņķis,D/D1,Jēkabpils pilsētas Krustpils kultūras nama vidējās paaudzes deju kolektīvs “Kreicburga”,Aija Rūliete,"55,0",Augstākā pakāpe,"45,0",10
Jelgavas pilsēta,Jelgavas pilsēta,D/D1,"Jelgavas pilsētas pašvaldības iestādes ""Kultūra"" Vidējās paaudzes deju kolektīvs ""Laipa""",Mārīte Skrinda,"55,0",Augstākā pakāpe,"45,0",10
Līvānu novads,Preiļu apriņķis,D,Līvānu novada kultūras centra vidējās paaudzes deju kolektīvs “Daugavieši”   ,Andrejs Usārs,"54,8",I pakāpe,"44,8",10
Priekuļu novads,Cēsu apriņķis,D,"Priekuļu novada Priekuļu pagasta kultūras nama Vidējās paaudzes deju kolektīvs ""Jumis""",Uldis Blīgzna,"54,8",I pakāpe,"44,8",10
Stopiņu novads,Siguldas apriņķis,D,"Stopiņu novada Ulbrokas kultūras nama Vidējās paaudzes deju kolektīvs ""Stopiņš""",Aiga Medne,"54,8",I pakāpe,"44,8",10
Krimuldas novads,Siguldas apriņķis,D,"Krimuldas novada Krimuldas tautas nama Vidējās paaudzes deju kolektīvs ""Dzirnakmeņi""",Līga Dombrovska,"54,7",I pakāpe,"44,7",10
Inčukalna novads,Siguldas apriņķis,D,"Inčukalna novada domes tautas nama Vidējās paaudzes deju kolektīvs ""Virši""",Andrs Briņķis,"54,3",I pakāpe,"44,3",10
Lielvārdes novads,Ogres apriņķis,D,Lielvārdes novada Kultūras centra struktūrvienības kultūras nama “Lielvārde” vidējās paaudzes deju kolektīvs “Lāčplēsis”     ,Andris Koknevičs,"54,3",I pakāpe,"44,3",10
Baldones novads,Pierīgas apriņķis,D,"Baldones novada pašvaldības Vidējās paaudzes deju kolektīvs ""Degsme""",Anda Krišāne,"54,2",I pakāpe,"44,2",10
Dobeles novads,Dobeles apriņķis,D,"Dobeles kultūras nama Vidējās paaudzes deju kolektīvs ""Dzīpars""",Gints Baumanis,"54,2",I pakāpe,"44,2",10
Mālpils novads,Siguldas apriņķis,D,"Mālpils novada kultūras centra Vidējās paaudzes deju kolektīvs ""Sidgunda""",Māra Gaile - Dišereite,"54,2",I pakāpe,"44,2",10
Ogres novads,Ogres apriņķis,D,Ogres novada Suntažu  pagasta  Suntažu kultūras nama vidējās paaudzes deju kolektīvs “Sunta”    ,Skaidrīte Andževa,"54,2",I pakāpe,"44,2",10
Carnikavas novads,Siguldas apriņķis,D,"Carnikavas novada Carnikavas tautas nama ""Ozolaine"" Vidējās paaudzes deju kolektīvs ""Arnika""",Andis Lēnmanis,"53,8",I pakāpe,"43,8",10
Salaspils novads,Pierīgas apriņķis,D,"Salaspils novada kultūras nama ""Rīgava"" Vidējās paaudzes deju kolektīvs ""Ūsa""",Brigita Čikste,"53,8",I pakāpe,"43,8",10
Valmieras pilsēta,Valmieras apriņķis,D,"Valmieras Kultūras centra Vidējās paaudzes deju kolektīvs ""Pastalnieki""",Jānis Psjuks,"53,8",I pakāpe,"43,8",10
Vecpiebalgas novads,Cēsu apriņķis,D,"Vecpiebalgas novada Vecpiebalgas pagasta kultūras nama Vidējās paaudzes deju kolektīvs ""Balga""",Kaspars Brauns,"53,8",I pakāpe,"43,8",10
Ķekavas novads,Pierīgas apriņķis,D/D1,"Ķekavas novada pašvaldības Ķekavas kultūras nama Vidējās paaudzes deju kolektīvs ""Zīle""",Vita Timermane,"53,8",I pakāpe,"43,8",10
Ķeguma novads,Ogres apriņķis,D,Ķeguma novada Ķeguma tautas nama vidējās paaudzes deju kolektīvs “Kadiķis”    ,Juris Čakans,"53,7",I pakāpe,"43,7",10
Jūrmalas pilsēta,Tukuma apriņķis,D/D1,Jūrmalas pilsētas Kultūras centra vidējās paaudzes deju kolektīvs „Vēlreiz”,Vita Pole,"53,5",I pakāpe,"43,5",10
Rīgas pilsēta,Rīgas pilsēta,D/D1,Biedrības „Vidējās paaudzes deju kolektīvs „Grieži”” vidējās paaudzes deju kolektīvs „Grieži”,Sanda Ģīle,"53,5",I pakāpe,"43,5",10
Iecavas novads,Bauskas apriņķis,D,"Iecavas novada Vidējās paaudzes deju kolektīvs ""Iecava""",Guntars Jansons,"53,3",I pakāpe,"43,3",10
Aizkraukles novads,Aizkraukles apriņķis,D,"Aizkraukles novada kultūras nama Aizkraukles pagasta Vidējās paaudzes deju kolektīvs ""Pēda""",Una Stakle,"53,0",I pakāpe,"43,0",10
Kokneses novads,Aizkraukles apriņķis,D,"Kokneses novada Kokneses kultūras nama Vidējās paaudzes deju kolektīvs ""Rats""",Laura Freimane,"53,0",I pakāpe,"43,0",10
Bauskas novads,Bauskas apriņķis,D,"Ceraukstes pagasta Vidējās paaudzes deju kolektīvs ""Dzirnavnieki""",Guntars Jansons,"52,8",I pakāpe,"42,8",10
Lielvārdes novads,Ogres apriņķis,D,Lielvārdes novada Kultūras centra struktūrvienības Jumpravas kultūras nams vidējās paaudzes deju kolektīvs “Saime”    ,Aija Ērgle,"52,8",I pakāpe,"42,8",10
Siguldas novads,Siguldas apriņķis,D,"Siguldas novada Kultūras centra Vidējās paaudzes deju kolektīvs ""Dūka""",Ieva Roķe,"52,8",I pakāpe,"42,8",10
Ārzemes,Ārzemes,D,"Vidējās paaudzes deju kolektīvs ""Ramtai"" (Šveice)",Jānis Vinklers,"52,7",I pakāpe,"42,7",10
Jēkabpils novads,Jēkabpils apriņķis,D,Jēkabpils novada Zasas pagasta Zasas kultūras nama vidējās paaudzes deju kolektīvs “Solis”   ,Daiga Ģeidāne,"52,7",I pakāpe,"42,7",10
Beverīnas novads,Valmieras apriņķis,D,"Beverīnas novada pašvaldības Kauguru pagasta kultūras nama Vidējās paaudzes deju kolektīvs ""Mūri""",Iluta Uškāne,"52,5",I pakāpe,"42,5",10
Krāslavas novads,Krāslavas apriņķis,D,Krāslavas novada Krāslavas kultūras nama vidējās paaudzes deju kolektīvs “Raita”  ,Valda Timule,"52,5",I pakāpe,"42,5",10
Rīgas pilsēta,Rīgas pilsēta,D,Agra Daņiļeviča deju skolas „Dzirnas” vidējās paaudzes deju kolektīvs „Dzirnu senči”,Gatis Neimanis,"52,5",I pakāpe,"42,5",10
Saldus novads,Saldus apriņķis,D,Saldus novada Saldus pagasta Druvas kultūras nama vidējās paaudzes deju kolektīvs “Druva”  ,Ina Jurcika,"52,5",I pakāpe,"42,5",10
Rīgas pilsēta,Rīgas pilsēta,D/D1,VEF Kultūras pils vidējās paaudzes deju kolektīvs „Daugava”,Gints Baumanis,"52,5",I pakāpe,"42,5",10
Cēsu novads,Cēsu apriņķis,D,"Cēsu novada pašvaldības aģentūras ""Cēsu Kultūras un Tūrisma centrs"" Vidējās paaudzes deju kolektīvs ""Raitais solis""",Andis Kozaks,"52,3",I pakāpe,"42,3",10
Saldus novads,Saldus apriņķis,D,Saldus novada Jaunauces pagasta vidējās paaudzes deju kopa    ,Inguna Balcere,"52,3",I pakāpe,"42,3",10
Dobeles novads,Dobeles apriņķis,D,"Dobeles novada Krimūnu tautas nama Vidējās paaudzes deju kolektīvs ""Akači""",Elīna Medne,"52,2",I pakāpe,"42,2",10
Madonas novads,Madonas apriņķis,D,Madonas novada Sarkaņu pagasta tautas nama “Kalnagravas” vidējās paaudzes deju kolektīvs “Kalnagravas”   ,Jeļena Rudzīte,"52,2",I pakāpe,"42,2",10
Rīgas pilsēta,Rīgas pilsēta,D,SIA „Arodbiedrību klubs „Vecrīga”” vidējās paaudzes deju kolektīvs „Rīdzenieks”,Viesturs Virza,"52,2",I pakāpe,"42,2",10
Ādažu novads,Siguldas apriņķis,D,"Ādažu novada Ādažu kultūras centra Vidējās paaudzes deju kopa ""Sprigulis""",Līga Lancmane,"52,0",I pakāpe,"42,0",10
Ērgļu novads,Madonas apriņķis,D,Ērgļu novada Ērgļu pagasta Ērgļu saieta nama vidējās paaudzes deju kolektīvs “Pastalnieki”,Mārīte Taškāne,"52,0",I pakāpe,"42,0",10
Garkalnes novads,Siguldas apriņķis,D,"Garkalnes novada domes kultūras centra ""Berģi"" deju ansamblis ""Greizie rati""",Ingus Ladiga un Ilze Mažāne,"52,0",I pakāpe,"42,0",10
Ikšķiles novads,Pierīgas apriņķis,D,"Ikšķiles novada Tīnūžu tautas nama Vidējās paaudzes deju kolektīvs ""Upe""",Didzis Apsītis,"52,0",I pakāpe,"42,0",10
