Rīgas pilsēta,Rīgas pilsēta,A,"Rīgas pašvaldības Kultūras iestāžu apvienības Koncertorganizācijas ,,Ave Sol” Tautas deju ansamblis „Teiksma”",Jānis  Ērglis,"64,8",Augstākā pakāpe,"49,8",15
Burtnieku novads,Valmieras apriņķis,A,"Burtnieku novada Valmieras pagasta kultūras nama Jauniešu deju kolektīvs ""Sadancis""",Ieva Adāviča,"64,2",Augstākā pakāpe,"49,2",15
Rīgas pilsēta,Rīgas pilsēta,A,Rīgas kultūras un tautas mākslas centra „Mazā ģilde” deju ansamblis “Daiļrade”,Iveta Pētersone-Lazadāne,"64,2",Augstākā pakāpe,"49,2",15
Rīgas pilsēta,Rīgas pilsēta,A,Latvijas Universitātes biedrības „Juventus” Tautas deju ansamblis „Dancis”,Rolands Juraševskis,"64,0",Augstākā pakāpe,"49,0",15
Jelgavas pilsēta,Jelgavas pilsēta,A,"Jelgavas pilsētas pašvaldības iestādes ""Kultūra"" Tautas deju ansamblis ""Lielupe""",Elita Simsone,"63,8",Augstākā pakāpe,"48,8",15
Rīgas pilsēta,Rīgas pilsēta,A,VEF Kultūras pils Tautas deju ansamblis „Gatve”,Gunta Raipala,"63,7",Augstākā pakāpe,"48,7",15
Rīgas pilsēta,Rīgas pilsēta,A,Rīgas kultūras un tautas mākslas centra „Mazā Ģilde” Tautas deju ansamblis „Līgo”,Jānis Purviņš,"63,7",Augstākā pakāpe,"48,7",15
Jelgavas pilsēta,Jelgavas pilsēta,A,"Latvijas Lauksaimniecības universitātes Tautas deju ansamblis ""Kalve""",Gunta Skuja,"63,2",Augstākā pakāpe,"48,2",15
Rīgas pilsēta,Rīgas pilsēta,A,Rīgas Tehniskās universitātes Tautas deju ansamblis “Vektors”,Dagmāra Bārbale,"62,8",Augstākā pakāpe,"47,8",15
Rīgas pilsēta,Rīgas pilsēta,A,Rīgas Stradiņa universitātes Tautas deju ansamblis „Ačkups”,Elita Treilone,"62,7",Augstākā pakāpe,"47,7",15
Rīgas pilsēta,Rīgas pilsēta,A,VEF Kultūras pils Tautas deju ansamblis „Rotaļa”,Gints Baumanis,"62,7",Augstākā pakāpe,"47,7",15
Jelgavas pilsēta,Jelgavas pilsēta,A,"Jelgavas pilsētas pašvaldības iestādes ""Kultūra"" Tautas deju ansamblis ""Diždancis""",Ieva Karele,"62,3",Augstākā pakāpe,"47,3",15
Lielvārdes novads,Ogres apriņķis,A,Lielvārde novada Kultūras centra struktūrvienības kultūras nams “Lielvārde” jauniešu deju kolektīvs “Pūpolītis”   ,Iluta Mistre,"62,2",Augstākā pakāpe,"47,2",15
Rīgas pilsēta,Rīgas pilsēta,A,Rīgas Celtniecības koledžas jauniešu deju kolektīvs „Austris”,Elita Treilone,"62,0",Augstākā pakāpe,"47,0",15
Liepājas pilsēta,Liepājas apriņķis,A,Liepājas Universitātes jauniešu deju kolektīvs “Banga” ,Kristīne Kārkliņa,"61,8",Augstākā pakāpe,"46,8",15
Rīgas pilsēta,Rīgas pilsēta,A,Biedrības „Tautas deju un mūzikas klubs „Liesma”” Tautas deju ansamblis „Liesma”,Jānis Marcinkevičs,"61,8",Augstākā pakāpe,"46,8",15
Siguldas novads,Siguldas apriņķis,A,"Siguldas novada Siguldas pagasta Jauniešu deju kolektīvs ""Vizbulīte""",Indra Ozoliņa,"61,8",Augstākā pakāpe,"46,8",15
Valmieras pilsēta,Valmieras apriņķis,A,"Valmieras Kultūras centra Tautas deju ansamblis ""Gauja""",Evita Kaķīte - Brasa,"61,2",Augstākā pakāpe,"46,2",15
Bauskas novads,Bauskas apriņķis,A,"Bauskas Kultūras centra Tautas deju ansamblis ""Jandāls""",Tamāra Ļisovcova,"59,5",I pakāpe,"44,5",15
Rīgas pilsēta,Rīgas pilsēta,A,Rīgas Pedagoģijas un izglītības vadības akadēmijas deju ansamblis „Pērle”,Raimonds Dzintars,"59,5",I pakāpe,"44,5",15
Ķekavas novads,Pierīgas apriņķis,A,"Ķekavas novada pašvaldības Ķekavas Kultūras nama Tautas deju ansamblim ""Zīle""",Vita Timermane,"59,0",I pakāpe,"44,0",15
Jelgavas pilsēta,Jelgavas pilsēta,A,"Jelgavas pilsētas pašvaldības iestādes ""Kultūra"" Tautas deju ansamblis ""Jaunība""",Arvils Noviks,"58,8",I pakāpe,"43,8",15
Ogres novads,Ogres apriņķis,A,Ogres novada Kultūras centra Tautas deju ansamblis “Ogre”  ,Edgars Tabors,"58,8",I pakāpe,"43,8",15
Garkalnes novads,Siguldas apriņķis,A,"Garkalnes novada domes kultūras centra ""Berģi"" deju ansamblis ""Ritenītis""",Ilze Mažāne un Ingus Ladiga,"58,7",I pakāpe,"43,7",15
Limbažu novads,Limbažu apriņķis,A,"Limbažu Bērnu un jauniešu centra Tautas deju ansamblis ""Katvari""", Edžus Arums,"58,7",I pakāpe,"43,7",15
Salaspils novads,Pierīgas apriņķis,A,"Salaspils novada kultūras nama ""Rīgava"" Jauniešu deju kolektīvs ""Ūsiņš""",Mārtiņš Pēdājs,"58,5",I pakāpe,"43,5",15
Daugavpils pilsēta,Daugavpils apriņķis,A,Daugavpils pilsētas Latviešu kultūras centra deju ansamblis “Laismeņa”   ,Diāna Soldāne,"58,2",I pakāpe,"43,2",15
Rīgas pilsēta,Rīgas pilsēta,A,Bērnu un jauniešu centra “Rīgas skolēnu pils” Tautas deju ansamblis “UGUNTIŅA”,Gita Ūdre,"58,2",I pakāpe,"43,2",15
Rīgas pilsēta,Rīgas pilsēta,A,VEF Kultūras pils jauniešu deju kolektīvs „Zalktis”,Zane Behmane,"58,0",I pakāpe,"43,0",15
Daugavpils novads,Daugavpils apriņķis,A,Daugavpils novada kultūras centra “Vārpa” Tautas deju ansamblis “Līksme”,Aija Daugele,"57,8",I pakāpe,"42,8",15
Liepājas pilsēta,Liepājas apriņķis,A,Liepājas Tautas mākslas un kultūras centra Tautas deju ansamblis “Rucavietis”,Justs Celms,"56,7",I pakāpe,"41,7",15
Rīgas pilsēta,Rīgas pilsēta,A,VEF Kultūras pils jauniešu deju kopa „Bramaņi”,Taiga Ludborža,"56,7",I pakāpe,"41,7",15
Rīgas pilsēta,Rīgas pilsēta,A,Rīgas pašvaldības kultūras iestāžu apvienības Kultūras pils „Ziemeļblāzma” deju ansamblis „Pērkons”,Andris Bergmanis,"56,7",I pakāpe,"41,7",15
Rīgas pilsēta,Rīgas pilsēta,A,VEF Kultūras pils Tautas deju ansamblis „Dardedze”,Ilze Kronberga,"56,3",I pakāpe,"41,3",15
Rīgas pilsēta,Rīgas pilsēta,A,Andreja Pumpura Rīgas 11. pamatskolas jauniešu deju kolektīvs “DZĪPARS”,Renāte Linde,"55,5",I pakāpe,"40,5",15
Cēsu novads,Cēsu apriņķis,A,"Cēsu novada pašvaldības aģentūras ""Cēsu Kultūras un Tūrisma centrs"" Tautas deju ansamblis ""Raitais solis""",Andis Kozaks,"54,5",II pakāpe,"39,5",15
Ventspils pilsēta,Ventspils apriņķis,A,Ventspils pilsētas domes Kultūras centra Ventspils Augstskolas jauniešu deju kolektīvs “Strautuguns”    ,Ineta Judzika,"54,3",II pakāpe,"39,3",15
Tukuma novads,Tukuma apriņķis,A,Tukuma novada Tukuma pilsētas kultūras nama Tautas deju ansamblis „Svīta” ,Gatis Konrads,"53,7",II pakāpe,"38,7",15
Balvu novads,Balvu apriņķis,Bērni,"Balvu Kultūras un atpūtas centra Bērnu deju kolektīvs ""Balvu vilciņš""",Zane Meiere,"48,7",Augstākā pakāpe,"48,7",0
Jelgavas pilsēta,Jelgavas pilsēta,Bērni,"Jelgavas pilsētas pašvaldības iestādes ""Kultūra"" Bērnu un jauniešu deju kolektīvs ""Vēja zirdziņš""",Alda Skrastiņa,"48,5",Augstākā pakāpe,"48,5",0
Rīgas pilsēta,Rīgas pilsēta,Bērni,Rīgas Franču liceja deju kolektīvs „AUSEKLĪTIS”,Iveta Pētersone-Lazadāne,"48,5",Augstākā pakāpe,"48,5",0
Rīgas pilsēta,Rīgas pilsēta,Bērni,Rīgas pašvaldības kultūras iestāžu apvienības koncertorganizācijas „Ave Sol” bērnu deju kolektīvs „Teiksmiņa” ,Inga Pulmane,"48,3",Augstākā pakāpe,"48,3",0
Ķekavas novads,Pierīgas apriņķis,Bērni,"Ķekavas novada Ķekavas vidusskolas Tautas deju kolektīvs ""Ķekaviņa"" II",Irisa Gaile,"48,2",Augstākā pakāpe,"48,2",0
Rīgas pilsēta,Rīgas pilsēta,Bērni,VEF Kultūras pils Tautas deju ansamblis „Zelta Sietiņš”,Baiba Rasma Šteina,"48,0",Augstākā pakāpe,"48,0",0
Kuldīgas novads,Kuldīgas apriņķis,Bērni,Kuldīgas novada Pašvaldības aģentūras  “Kuldīgas kultūras centrs” bērnu deju kolektīvs “Stariņš”  ,Zita Serdante,"47,7",Augstākā pakāpe,"47,7",0
Priekuļu novads,Cēsu apriņķis,Bērni,"Priekuļu novada Priekuļu pagasta Priekuļu kultūras nama Bērnu deju kolektīvs ""Tūgadiņš""",Mārtiņš Jurciņš,"47,3",Augstākā pakāpe,"47,3",0
Rīgas pilsēta,Rīgas pilsēta,Bērni,Kultūras un tautas mākslas centra „Mazā ģilde” bērnu Tautas deju ansamblis „Dzintariņš”,Olga Freiberga,"47,3",Augstākā pakāpe,"47,3",0
Preiļu novads,Preiļu apriņķis,Bērni,Preiļu pilsētas Bērnu un jauniešu centra deju kopa “Gaida”   ,Gaida Ivanova,"47,0",Augstākā pakāpe,"47,0",0
Cēsu novads,Cēsu apriņķis,Bērni,"Cēsu novada pašvaldības aģentūras ""Cēsu Kultūras un Tūrisma centrs"" Tautas deju kolektīvs ""Randiņš""",Sandra Bārtniece,"46,8",Augstākā pakāpe,"46,8",0
Ķekavas novads,Pierīgas apriņķis,Bērni,"Ķekavas novada pašvaldības Ķekavas kultūras nama Bērnu deju kolektīvs ""Daina""",Daina Marija Zozuļa,"46,5",Augstākā pakāpe,"46,5",0
Jūrmalas pilsēta,Tukuma apriņķis,Bērni,Jūrmalas pilsētas Jūrmalas Kultūras centra Kauguru kultūras nama bērnu deju kolektīvs “Vizmiņa”,Ineta Tālzeme,"46,3",Augstākā pakāpe,"46,3",0
Rīgas pilsēta,Rīgas pilsēta,Bērni,Agra Daņiļeviča deju skolas „Dzirnas” bērnu deju kolektīvs „Dzirnas”,Agris Daņiļevičs,"46,3",Augstākā pakāpe,"46,3",0
Jelgavas pilsēta,Jelgavas pilsēta,Bērni,"Jelgavas Bērnu un jauniešu centra ""Junda"" Bērnu deju kolektīvs ""Jundēni"", I sastāvs",Madlēna Bratkus,"45,8",Augstākā pakāpe,"45,8",0
Madonas novads,Madonas apriņķis,Bērni,Madonas novada Madonas pilsētas kultūras nama bērnu deju kolektīvs “Pipariņi”    ,Gunta Beķere,"45,7",Augstākā pakāpe,"45,7",0
Krāslavas novads,Krāslavas apriņķis,Bērni,Krāslavas pilsētas pamatskolas un Krāslavas Bērnu un jauniešu centra bērnu deju kolektīvs “Pastaliņas”,Valda Timule,"45,3",Augstākā pakāpe,"45,3",0
Liepājas pilsēta,Liepājas apriņķis,Bērni,Liepājas Bērnu un jaunatnes centra bērnu deju kolektīvs “Vaduguns”  ,Inta Blumbaha,"45,3",Augstākā pakāpe,"45,3",0
Rīgas pilsēta,Rīgas pilsēta,Bērni,Biedrības „Tautas deju un mūzikas klubs „Liesma”” bērnu Tautas deju ansamblis „Dzirkstelīte”,Jānis Marcinkevičs,"45,3",Augstākā pakāpe,"45,3",0
Bauskas novads,Bauskas apriņķis,Bērni,"Bauskas Bērnu un jauniešu centra Bērnu deju kopa ""Mēmelīte""",Ligita Irbīte,"45,2",Augstākā pakāpe,"45,2",0
Rīgas pilsēta,Rīgas pilsēta,Bērni,Bērnu un jauniešu centra  „IK AUSEKLIS” deju kolektīvs „DANCĪTIS”,Ilze Dzene,"45,2",Augstākā pakāpe,"45,2",0
Rīgas pilsēta,Rīgas pilsēta,Bērni,Bērnu un jauniešu centra „Rīgas Skolēnu pils” Tautas deju ansamblis „UGUNTIŅA”,Gita Ūdre,"45,2",Augstākā pakāpe,"45,2",0
Rīgas pilsēta,Rīgas pilsēta,Bērni,Rīgas 64. vidusskolas deju kolektīvs „DZĒRVENĪTE”,Agnese Meliņa un Agnese Stanke,"44,8",I pakāpe,"44,8",0
Valmieras pilsēta,Valmieras apriņķis,Bērni,"Valmieras Jauniešu centra ""Vinda"" deju kopa ""Liesmiņa""",Liana Ozoliņa,"44,8",I pakāpe,"44,8",0
Grobiņas novads,Liepājas apriņķis,Bērni,Grobiņas sākumskolas bērnu deju kolektīvs   ,Iveta Dambe,"44,7",I pakāpe,"44,7",0
Jelgavas pilsēta,Jelgavas pilsēta,Bērni,"Jelgavas Bērnu un jauniešu centra ""Junda"" Bērnu deju kolektīvs ""Jundēni"", II sastāvs",Madlēna Bratkus,"44,5",I pakāpe,"44,5",0
Rīgas pilsēta,Rīgas pilsēta,Bērni,Biedrības „Tautas deju un mūzikas klubs „Liesma”” Bērnu deju ansamblis „DZĪPARIŅŠ”,Renāte Linde,"44,5",I pakāpe,"44,5",0
Dobeles novads,Dobeles apriņķis,Bērni,"Dobeles kultūras nama bērnu deju kolektīvs ""Drellīši""",Gints Baumanis,"44,0",I pakāpe,"44,0",0
Iecavas novads,Bauskas apriņķis,Bērni,Iecavas vidusskolas 3.-4. klašu bērnu deju kolektīvs,Solveiga Lineja,"44,0",I pakāpe,"44,0",0
Ikšķiles novads,Pierīgas apriņķis,Bērni,"Ikšķiles novada Tīnūžu tautas nama Bērnu deju kolektīvs ""Upīte""",Didzis Apsītis,"43,2",I pakāpe,"43,2",0
Babītes novads,Pierīgas apriņķis,Bērni,"Babītes novada pašvaldības Kultūrizglītības centra Bērnu deju kolektīvs ""Kaspīne""",Dace Veide,"42,7",I pakāpe,"42,7",0
Gulbenes novads,Gulbenes apriņķis,Bērni,"Gulbenes vidusskolas Bērnu deju kolektīvs ""Spārēni""",Daiga Tipāne,"42,5",I pakāpe,"42,5",0
Rīgas pilsēta,Rīgas pilsēta,Bērni,Rīgas pašvaldības Kultūras iestāžu apvienības Kultūras pils „Ziemeļblāzma” bērnu deju kolektīvs  „Bitīte”,Gundega Prancāne,"42,5",I pakāpe,"42,5",0
Dagdas novads,Krāslavas apriņķis,Bērni,Dagdas novada Bērnu un jauniešu centra bērnu deju kolektīvs “Dardedze”   ,Rita Vaišļa,"42,3",I pakāpe,"42,3",0
Ērgļu novads,Madonas apriņķis,Bērni,Ērgļu novada Ērgļu vidusskolas bērnu deju kolektīvs  ,Antra Grīnberga,"42,3",I pakāpe,"42,3",0
Ķekavas novads,Pierīgas apriņķis,Bērni,"Ķekavas novada Ķekavas vidusskolas Bērnu deju kolektīvs ""Ķekaviņa""",Irisa Gaile,"42,2",I pakāpe,"42,2",0
Mālpils novads,Siguldas apriņķis,Bērni,"Mālpils novada vidusskolas Bērnu deju kolektīvs ""Dundiņa""",Māra Gaile - Dišereite,"42,2",I pakāpe,"42,2",0
Madonas novads,Madonas apriņķis,Bērni,Madonas novada Madonas pilsētas kultūras nama bērnu deju kolektīvs “Mazā deju skola”   ,Maija Rijniece,"42,0",I pakāpe,"42,0",0
Liepājas pilsēta,Liepājas apriņķis,Bērni,Liepājas Tautas mākslas un kultūras centra bērnu deju kolektīvs “Krustiņi”   ,Inta Āboliņa,"41,7",I pakāpe,"41,7",0
Mārupes novads,Pierīgas apriņķis,Bērni,"Mārupes novada Jaunmārupes pamatskolas Bērnu deju kolektīvs ""Ozolēni""",Anita Ozoliņa,"41,5",I pakāpe,"41,5",0
Carnikavas novads,Siguldas apriņķis,Bērni,"Carnikavas novada Carnikavas tautas nama ""Ozolaine"" Bērnu deju kolektīvs ""Dālderītis""",Anita un Jānis Precinieki,"41,0",I pakāpe,"41,0",0
Talsu novads,Talsu apriņķis,Bērni,Talsu novada Ģibuļu pagasta Pastendes pamatskolas bērnu deju kolektīvs “Jumalēni”   ,Lelde Hodjačika,"40,8",I pakāpe,"40,8",0
Limbažu novads,Limbažu apriņķis,Bērni,"Limbažu Kultūras nama Bērnu deju kolektīvs ""Saktiņa""",Ineta Indriksone,"40,5",I pakāpe,"40,5",0
Jaunjelgavas novads,Aizkraukles apriņķis,Bērni,"Jaunjelgavas novada kultūras nama Bērnu deju kolektīvs ""Kodoliņš""",Gunita Krievāne,"40,3",I pakāpe,"40,3",0
Ogres novads,Ogres apriņķis,Bērni,Ogres novada Ķeipenes pagasta Ķeipenes tautas nama bērnu deju kolektīvs “Zeltupīte”,Agnese Lepse,"40,2",I pakāpe,"40,2",0
Talsu novads,Talsu apriņķis,Bērni,Talsu sākumskolas bērnu deju kolektīvs “Sprīdīši”,Iveta Kālberga,"40,2",I pakāpe,"40,2",0
Ogres novads,Ogres apriņķis,Bērni,Ogres novada Ogresgala pagasta Ogresgala tautas nama bērnu deju kolektīvs “Ābolēni”     ,Egita Tontegode,"40,0",I pakāpe,"40,0",0
Valmieras pilsēta,Valmieras apriņķis,Bērni,"Valmieras sākumskolas Bērnu deju kolektīvs ""Pērkonītis""",Liesma Ērgle,"40,0",I pakāpe,"40,0",0
Mazsalacas novads,Valmieras apriņķis,Bērni,"Mazsalacas vidusskolas Bērnu deju kolektīvs ""Ķipari""",Aija Vidovska,"39,8",II pakāpe,"39,8",0
Pārgaujas novads,Cēsu apriņķis,Bērni,Pārgaujas novada Stalbes vidusskolas 1.-4. klašu deju kolektīvs,Ginta Berķe,"39,5",II pakāpe,"39,5",0
Lubānas novads,Madonas apriņķis,Bērni,Lubānas novada Lubānas vidusskolas bērnu deju kolektīvs   ,Inese Straume,"39,3",II pakāpe,"39,3",0
Ogres novads,Ogres apriņķis,Bērni,Ogres novada Lauberes pagasta Lauberes kultūras nama bērnu deju kolektīvs “Bitītes”   ,Inese Putroma,"39,3",II pakāpe,"39,3",0
Tukuma novads,Tukuma apriņķis,Bērni,Tukuma novads Tukuma Mākslas skolas bērnu deju kolektīvs „Luste,Madara Augule,"38,8",II pakāpe,"38,8",0
Ogres novads,Ogres apriņķis,Bērni,Ogres novada Suntažu vidusskolas bērnu deju kolektīvs   ,Ināra Ozoliņa,"38,3",II pakāpe,"38,3",0
Tukuma novads,Tukuma apriņķis,Bērni,Tukuma novada Tukuma 2.pamatskolas bērnu deju kolektīvs,Juris Poga,"38,2",II pakāpe,"38,2",0
Aizkraukles novads,Aizkraukles apriņķis,Bērni,"Aizkraukles novada kultūras nama Aizkraukles pagasta Bērnu deju kolektīvs ""Aizkrauklēni""",Una Stakle,"37,5",II pakāpe,"37,5",0
Saldus novads,Saldus apriņķis,Bērni,Saldus novada Druvas vidusskolas bērnu deju kolektīvs “Mazais Puzurs” ,Agita Skrebele,"37,0",II pakāpe,"37,0",0
Priekuļu novads,Cēsu apriņķis,Bērni,"Priekuļu novada Priekuļu pagasta Priekuļu vidusskolas Bērnu deju kolektīvs ""Miķelēni""",Māris Brasliņš,"36,3",II pakāpe,"36,3",0
Salacgrīvas novads,Limbažu apriņķis,Bērni,"Salacgrīvas vidusskolas Bērnu deju kolektīvs ""Vēverīši""",Anita Gīze,"36,3",II pakāpe,"36,3",0
Saulkrastu novads,Siguldas apriņķis,Bērni,"Saulkrastu novada Saulkrastu vidusskolas Bērnu deju kolektīvs ""Saulīte""",Jānis Trezuns,"36,3",II pakāpe,"36,3",0
Limbažu novads,Limbažu apriņķis,Bērni,"Skultes pagasta Skultes Kultūras intergrācijas centra Bērnu deju kolektīvs ""Ziķeri""",Elīna Medne,"34,3","III pakāpe 
Neizvirzīt 2018.gada skatēm","34,3",0
Smiltenes novads,Smiltenes apriņķis,Bērni,"Smiltenes Bērnu un jauniešu interešu izglītības centra Bērnu deju kolektīvs ""Knēvelīši""",Laura Reimane,"34,3","III pakāpe 
Neizvirzīt 2018.gada skatēm","34,3",0
Salacgrīvas novads,Limbažu apriņķis,Bērni,"Liepupes vidusskolas Bērnu deju kolektīvs ""Liepupīte""",Jānis Trezuns,"33,7","III pakāpe 
Neizvirzīt 2018.gada skatēm","33,7",0
Limbažu novads,Limbažu apriņķis,Bērni,"Viļķenes pagasta kultūras nama Bērnu deju kolektīvs ""Trejdeviņi""",Baiba Adamoviča,"30,5","III pakāpe 
Neizvirzīt 2018.gada skatēm","30,5",0
Jaunjelgavas novads,Aizkraukles apriņķis,Bērni,"Jaunjelgavas novada Daudzes pamatskolas tautas deju kolektīvs ""Sienāzītis""",Maruta Mīlīga,"25,2",Diploms par piedalīšanos neizvirzīt 2018.gada skatēm,"25,2",0
Saldus novads,Saldus apriņķis,Bērni,"Saldus novada Pašvaldības aģentūras “Saldus Tūrisma informācijas, kultūras un sporta centrs” bērnu deju kolektīvs “Dzīpars”    ",Baiba Rāzna,"21,3","Diploms par piedalīšanos
Neizvirzīt 2018.gada skatēm","21,3",0
Gulbenes novads,Gulbenes apriņķis,B,"Gulbenes Kultūras centra Jauniešu deju kolektīvs ""Zelta Rūsiņš""",Edīte Ķikuste,"58,8",Augstākā pakāpe,"48,8",10
Priekuļu novads,Cēsu apriņķis,B,"Priekuļu novada Priekuļu pagasta kultūras nama Jauniešu deju kolektīvs ""Zelta Virpulis""",Uldis Blīgzna,"58,5",Augstākā pakāpe,"48,5",10
Kuldīgas novads,Kuldīgas apriņķis,B,Kuldīgas novada Pašvaldības aģentūras  “Kuldīgas kultūras centrs” Tautas deju ansamblis “Venta”    ,Zita Serdante,"58,3",Augstākā pakāpe,"48,3",10
Rīgas pilsēta,Rīgas pilsēta,B,Rīgas pašvaldības kultūras iestāžu apvienības koncertorganizācijas „Ave Sol” Tautas deju ansambļa „Teiksma” studija,Inga Pulmane,"58,3",Augstākā pakāpe,"48,3",10
Siguldas novads,Siguldas apriņķis,B,"Siguldas novada Siguldas Valsts ģimnāzijas deju kolektīvs ""Vizbulīte""",Indra Ozoliņa,"58,3",Augstākā pakāpe,"48,3",10
Balvu novads,Balvu apriņķis,B,"Balvu Kultūras un atpūtas centra deju kopa ""Rika""",Agris Veismanis,"58,2",Augstākā pakāpe,"48,2",10
Jelgavas pilsēta,Jelgavas pilsēta,B,"Jelgavas pilsētas pašvaldības iestādes ""Kultūra"" Tautas deju ansamblis ""Lielupe""",Elita Simsone,"58,0",Augstākā pakāpe,"48,0",10
Rīgas pilsēta,Rīgas pilsēta,B,Rīgas Franču liceja deju kolektīvs „AUSEKLĪTIS”,Iveta Pētersone-Lazadāne,"58,0",Augstākā pakāpe,48,10
Ādažu novads,Siguldas apriņķis,B,"Ādažu novada Ādažu vidusskolas Jauniešu deju kolektīvs ""Rūta""",Ināra Mičule un Vita Reinbooma,"57,7",Augstākā pakāpe,"47,7",10
Limbažu novads,Limbažu apriņķis,B,"Limbažu Kultūras nama Jauniešu deju kolektīvs ""Jampadracis""",Andis Lēnmanis,"57,3",Augstākā pakāpe,"47,3",10
Rīgas pilsēta,Rīgas pilsēta,B,Agra Daņiļeviča deju skolas „Dzirnas” jauniešu deju kolektīvs „Dzirnas”,Agris Daņiļevičs,"57,3",Augstākā pakāpe,"47,3",10
Aizkraukles novads,Aizkraukles apriņķis,B,"Aizkraukles novada kultūras nama Aizkraukles pagasta Jauniešu deju kolektīvs ""Pēda""",Una Stakle,"57,2",Augstākā pakāpe,"47,2",10
Jelgavas pilsēta,Jelgavas pilsēta,B,"Jelgavas Bērnu un jauniešu centra ""Junda"" Jauniešu deju kolektīvs ""Jundari""",Madlēna Bratkus,"56,8",Augstākā pakāpe,"46,8",10
Jūrmalas pilsēta,Tukuma apriņķis,B,Jūrmalas pilsētas Kultūras centra jauniešu deju kolektīvs “Zālīte”,Zanda Pakere,"56,7",Augstākā pakāpe,"46,7",10
Rīgas pilsēta,Rīgas pilsēta,B,VEF Kultūras pils Tautas deju ansamblis „Zelta Sietiņš - 2”,Baiba Rasma Šteina,"56,5",Augstākā pakāpe,"46,5",10
Preiļu novads,Preiļu apriņķis,B,Preiļu novada Jāņa Eglīša Preiļu Valsts ģimnāzijas un Preiļu novada kultūras centra jauniešu deju kopa “Gaida” ,Gaida Ivanova ,"56,3",Augstākā pakāpe,"46,3",10
Ādažu novads,Siguldas apriņķis,B,"Ādažu novada Ādažu kultūras centra Tautas deju ansamblis ""Sprigulītis""",Liene Kļaviņa,"56,2",Augstākā pakāpe,"46,2",10
Iecavas novads,Bauskas apriņķis,B,Iecavas Kultūras nama Jauniešu deju kolektīvs,Solveiga Lineja,"55,7",Augstākā pakāpe,"45,7",10
Ilūkstes novads,Daugavpils apriņķis,B,Ilūkstes novada kultūras centra jauniešu deju kolektīvs “Labrīt”,Antonija Stalidzāne,"55,7",Augstākā pakāpe,"45,7",10
Jēkabpils pilsēta,Jēkabpils apriņķis,B,Jēkabpils pilsētas Krustpils kultūras nama jauniešu deju kolektīvs “Delveri”  ,Ingrīda Feldmane,"55,7",Augstākā pakāpe,"45,7",10
Lielvārdes novads,Ogres apriņķis,B,Lielvārdes novada Kultūras centra struktūrvienības Jumpravas kultūras nams jauniešu deju kolektīvs “Jumpraviņa”   ,Aija Ērgle,"55,7",Augstākā pakāpe,"45,7",10
Mazsalacas novads,Valmieras apriņķis,B,"Mazsalacas Kultūras centra jauniešu deju kolektīvs ""Magone""",Aija Vidovska,"55,7",Augstākā pakāpe,"45,7",10
Pļaviņu novads,Aizkraukles apriņķis,B,"Pļaviņu novada kultūras centra Jauniešu deju kolektīvs ""Daugaviņa""",Ineta Reitere,"55,7",Augstākā pakāpe,"45,7",10
Talsu novads,Talsu apriņķis,B,Talsu Tautas nama jauniešu deju kolektīvs “Delveri”   ,Lita Freimane,"55,7",Augstākā pakāpe,"45,7",10
Līvānu novads,Preiļu apriņķis,B,Līvānu novada kultūras centra Tautas deju ansamblis “Silava” ,Andrejs Usārs,"55,3",Augstākā pakāpe,"45,3",10
Preiļu novads,Preiļu apriņķis,B,Preiļu novada Jāņa Eglīša Preiļu Valsts ģimnāzijas un Preiļu novada kultūras centra jauniešu deju kopa “Dancari”  ,Ilze Broka,"55,2",Augstākā pakāpe,"45,2",10
Rīgas pilsēta,Rīgas pilsēta,B,Rīgas pašvaldības kultūras iestāžu apvienības Kultūras un atpūtas centra „Imanta” jauniešu deju kolektīvs „Imanta”,Aija Konstante,"55,2",Augstākā pakāpe,"45,2",10
Cēsu novads,Cēsu apriņķis,B,"Cēsu novada Cēsu Valsts ģimnāzijas Jauniešu deju kolektīvs ""Kande""",Andis Kozaks,"55,0",Augstākā pakāpe,"45,0",10
Durbes novads,Liepājas apriņķis,B,Durbes novada Vecpils pagasta saieta nama jauniešu deju kolektīvs “Lāņupīte”   ,Sandra Blumbaha,"55,0",Augstākā pakāpe,"45,0",10
Lubānas novads,Madonas apriņķis,B,Lubānas novada Lubānas pilsētas kultūras nama jauniešu deju kolektīvs “Žuburi”  ,Laila Ozoliņa,"54,8",I pakāpe,"44,8",10
Mālpils novads,Siguldas apriņķis,B,"Mālpils novada kultūras centra Jauniešu deju kolektīvs ""Māra""",Maija Orlova,"54,8",I pakāpe,"44,8",10
Rēzeknes pilsēta,Rēzeknes apriņķis,B,Rēzeknes pilsētas pašvaldības aģentūras “Rēzeknes Kultūras un tūrisma centrs” jauniešu deju kopa “Dziga”,Inga Drele,"54,8",I pakāpe,"44,8",10
Ērgļu novads,Madonas apriņķis,B,Ērgļu novada Ērgļu pagasta Ērgļu saieta nama jauniešu deju kolektīvs “Rūdis”,Antra Grīnberga,"54,7",I pakāpe,"44,7",10
Gulbenes novads,Gulbenes apriņķis,B,"Litenes pagasta tautas nama Jauniešu deju kolektīvs ""Litenietis""",Zaiga Mangusa,"54,7",I pakāpe,"44,7",10
Jelgavas novads,Jelgavas apriņķis,B,"Jelgavas novada Elejas pagasta saieta nama Jauniešu deju kolektīvs ""Tracis""",Ivita Lejava-Majore,"54,7",I pakāpe,"44,7",10
Limbažu novads,Limbažu apriņķis,B,"Skultes pagasta Skultes Kultūras intergrācijas centra Jauniešu deju kolektīvs ""Skulte""",Elīna Medne,"54,7",I pakāpe,"44,7",10
Bauskas novads,Bauskas apriņķis,B,"Bauskas Bērnu un jauniešu centra Jauniešu deju kolektīvs ""Mēmelīte""",Ligita Irbīte,"54,5",I pakāpe,"44,5",10
Tērvetes novads,Dobeles apriņķis,B,"Tērvetes novada Tērvetes kultūras nama Jauniešu deju kolektīvs ""Avots""",Elīna Medne,"54,5",I pakāpe,"44,5",10
Rīgas pilsēta,Rīgas pilsēta,B,Rīgas pašvaldības Kultūras iestāžu apvienības Kultūras centra „Iļģuciems” jauniešu deju kolektīvs „Latve”,Kristīne Jirgensone,"54,2",I pakāpe,"44,2",10
Viļānu novads,Rēzeknes apriņķis,B,Viļānu novada Viļānu kultūras nama jauniešu deju kopa “Austra”  ,Lūcija Kukaine,"54,2",I pakāpe,"44,2",10
Dobeles novads,Dobeles apriņķis,B,"Dobeles Kultūras nama Jauniešu deju kolektīvs ""Drīziņš""",Gints Baumanis,"54,0",I pakāpe,"44,0",10
Jelgavas pilsēta,Jelgavas pilsēta,B,"Latvijas Lauksaimniecības universitātes Jauniešu deju kolektīvs ""Skalbe""",Liene Liniņa,"54,0",I pakāpe,"44,0",10
Krāslavas novads,Krāslavas apriņķis,B,Krāslavas novada Krāslavas kultūras nama jauniešu deju kolektīvs “Raita”,Valda Timule,"53,8",I pakāpe,"43,8",10
Krimuldas novads,Siguldas apriņķis,B,"Krimuldas novada Lēdurgas kultūras nama Jauniešu deju kolektīvs ""Metieniņš""",Raivis Eglītis,"53,8",I pakāpe,"43,8",10
Rīgas pilsēta,Rīgas pilsēta,B,Rīgas 45. vidusskolas jauniešu deju kolektīvs “ČIEKURS”,Ineta Bērziņa,"53,8",I pakāpe,"43,8",10
Saulkrastu novads,Siguldas apriņķis,B,"Saulkrastu novada pašvaldības aģentūras ""Saulkrastu kultūras un sporta centrs"" Jauniešu deju kolektīvs ""Krustu šķērsu""",Jānis Kalniņš,"53,8",I pakāpe,"43,8",10
Grobiņas novads,Liepājas apriņķis,B,Grobiņas pilsētas domes jauniešu deju kolektīvs “Spararats”  ,Inga Papirte,"53,7",I pakāpe,"43,7",10
